{
  "format": "SIMS_DOCTOR_WRITER_REQUEST_V1",
  "contract_version": "1.0",
  "schema_version": "1.0.0",
  "source_system": "SIMS_DOCTOR",
  "target_system": "SIMS_WRITER",
  "message_id": "MSG-EX-0004",
  "generated_at": "2026-08-03T12:00:00+09:00",
  "timezone": "Asia/Tokyo",
  "site": {
    "site_id": "example",
    "site_name": "例",
    "blog_url": "https://example.com/"
  },
  "case": {
    "case_id": "CASE-EX-1",
    "case_type": "CONTENT_DECAY",
    "case_status": "TREATMENT_PENDING"
  },
  "treatment": {
    "treatment_id": "TRT-EX-1",
    "treatment_type": "CONTENT_DECAY_RECOVERY",
    "executor": "SIMS_WRITER",
    "objective": "回復"
  },
  "article": {
    "article_id": "A900001",
    "url": "https://example.com/a",
    "title": "例記事",
    "workflow_status": "DOCTOR_TREATMENT_PENDING"
  },
  "diagnosis_context": {
    "primary_diagnosis": "CONTENT_DECAY"
  },
  "editing_scope": {
    "allowed_sections": [
      "SEO_TITLE"
    ],
    "prohibited_actions": [
      "CHANGE_URL"
    ]
  },
  "protection": {},
  "expected_result": {},
  "return_contract": {
    "format": "SIMS_TREATMENT_RESULT_V1",
    "contract_version": "1.0",
    "return_to": "SIMS_DOCTOR"
  }
}